{
  "alias_updates": [
    {
      "aliases": [
        "Amazon",
        "AMZN",
        "アマゾン"
      ],
      "canonical_id": "amazon",
      "display_name": "Amazon",
      "entity_type": "company"
    },
    {
      "aliases": [
        "AWS",
        "Amazon Web Services",
        "アマゾンウェブサービス"
      ],
      "canonical_id": "amazon-web-services",
      "display_name": "AWS",
      "entity_type": "organization"
    },
    {
      "aliases": [
        "Apple",
        "AAPL",
        "アップル"
      ],
      "canonical_id": "apple",
      "display_name": "Apple",
      "entity_type": "company"
    },
    {
      "aliases": [
        "SOXX",
        "iShares Semiconductor ETF",
        "半導体ETF"
      ],
      "canonical_id": "soxx",
      "display_name": "SOXX",
      "entity_type": "other"
    }
  ],
  "approval": {
    "approved_at": "2026-08-03T04:43:12.204Z",
    "status": "approved_preview"
  },
  "central_hypothesis": {
    "confidence": "medium",
    "text": "昨夜の市場はAI設備投資の金額より、クラウド売上として回収が確認できるかを評価した。"
  },
  "claim_updates": [
    {
      "claim": "市場はAI設備投資の金額だけでなく、クラウド売上として回収が確認できるかを評価する。",
      "claim_id": "ai-capex-evaluation-axis",
      "confidence": "medium",
      "entities": [
        "Amazon",
        "AWS"
      ],
      "evidence_paths": [
        "memory-seeds/2026-07-31/source/episode_package_2026-07-31.md",
        "memory-seeds/2026-07-31/source/render_spec.json"
      ],
      "reason": "2026-07-31回ではAWS売上が市場予想を上回り、Amazonが上昇した一方、半導体への波及は限定的だったため。",
      "status": "active",
      "subject": "AI設備投資の評価軸",
      "thread_ids": [
        "ai-capex-payback"
      ],
      "topics": [
        "AI設備投資",
        "クラウド"
      ]
    }
  ],
  "contract_version": "1.0.0",
  "contrary_evidence": [
    "米10年債利回りは約4.75%へ上昇した",
    "Appleは7.35%下落した",
    "SOXXは0.07%高、AMDは1.90%安で、半導体全面高ではなかった",
    "市場セッション日付のメタデータと記事本文に一日のずれがあった"
  ],
  "entities": [
    "Amazon",
    "AWS",
    "Apple",
    "SOXX"
  ],
  "episode_date": "2026-07-31",
  "main_story": "Amazon決算でAWS売上が市場予想を上回り、AI投資の回収証拠として評価されたこと",
  "production_lessons": [],
  "revision": "v001",
  "source_hashes": {
    "episode_package": "6cc8f0f924b07b625fec421acab0735a27fbab6caf74a75722674ba7f4aa80b3",
    "render_spec": "f94a16574d44611efb23e0596274db1cb5f7b2c6b2d5f663dd76042026a2524c",
    "validator_report": "d3e43614275792064e42a234d34ac0c225f50c54aac054f7eb96555d5d451bf9"
  },
  "source_paths": {
    "episode_package": "memory-seeds/2026-07-31/source/episode_package_2026-07-31.md",
    "render_spec": "memory-seeds/2026-07-31/source/render_spec.json",
    "validator_report": "memory-seeds/2026-07-31/source/validator_report.json"
  },
  "story_spine": "AmazonではAWSの予想超過がAI投資の回収証拠として株価を押し上げ、NASDAQ全体では大型クラウド株の上昇が金利上昇とApple安を上回った一方、半導体への波及は限定的だった。",
  "thread_updates": [
    {
      "claim_ids": [
        "ai-capex-evaluation-axis"
      ],
      "entities": [
        "Amazon",
        "AWS"
      ],
      "question": "AI設備投資は売上としてどの程度回収されているか",
      "status": "active",
      "summary": "AWSの予想超過は、AI設備投資を支出額ではなく回収証拠で評価する材料になった。一方、半導体への波及は限定的だった。",
      "thread_id": "ai-capex-payback",
      "title": "AI設備投資の回収",
      "topics": [
        "AI設備投資",
        "クラウド"
      ],
      "triggers": [
        "AI設備投資",
        "クラウド売上",
        "AWS"
      ]
    }
  ],
  "title": "Amazon急騰でも半導体は横ばい　NASDAQが見たAI投資の答え",
  "topics": [
    "AI設備投資",
    "クラウド",
    "NASDAQ",
    "半導体"
  ],
  "watch_next": [
    "他のクラウド企業でもAI投資と売上成長が同時に続くか",
    "米10年債利回りが4.7%台でさらに上昇するか",
    "半導体が大型クラウド株の上昇へ追いつくか"
  ]
}
